{
  "schemaVersion": "1.0.0",
  "deploymentId": "ensv2-mainnet-placeholder",
  "chain": "eip155:1",
  "networkClass": "mainnet",
  "protocol": "ensv2",
  "status": "disabled",
  "artifactSource": {
    "kind": "git-repository",
    "reference": "https://github.com/ensdomains/contracts-v2",
    "commit": "a971bd6",
    "importedAt": "2026-08-25T12:00:00Z"
  },
  "abiBundle": {
    "version": "0.1.0-fixture",
    "integrity": "sha256-rOVm232Z4Bl0xKGYl7TgXw5pMGXPq/MMOn9mvpWYY8Y=",
    "location": "./artifacts/ensv2-sepolia.json"
  },
  "canonicality": {
    "universalResolver": "0x00000000000000000000000000000000000000ee",
    "check": {
      "method": "findCanonicalRegistry",
      "argument": "0x0365746800",
      "expectedRegistry": "0x00000000000000000000000000000000000000bd",
      "argumentLabel": "eth"
    },
    "failClosed": true
  },
  "contracts": {
    "ethRegistry": {
      "address": "0x00000000000000000000000000000000000000bd",
      "abiRef": "ETHRegistry"
    },
    "ethRegistrar": {
      "address": "0x00000000000000000000000000000000000000be",
      "abiRef": "ETHRegistrar"
    },
    "universalResolver": {
      "address": "0x00000000000000000000000000000000000000ee",
      "abiRef": "UniversalResolver"
    }
  },
  "registrationPaymentAsset": {
    "address": "0x00000000000000000000000000000000000000c0",
    "symbol": "TESTUSD",
    "decimals": 6
  },
  "commitment": {
    "minAgeSeconds": 60,
    "maxAgeSeconds": 86400
  },
  "tokenModel": {
    "standard": "erc1155-singleton",
    "tokenIdMutable": true,
    "stableIdentityKey": "resource"
  },
  "durationBounds": {
    "minSeconds": 2419200,
    "maxSeconds": 315360000
  },
  "verification": {
    "verifiedAt": "2026-08-25T12:00:00Z",
    "method": "both",
    "rpcEndpointsConsulted": 2,
    "notes": "Synthetic fixture addresses. Real values are generated by WS01 from pinned artifacts."
  }
}
